title,year,genre,plot
Jurassic Park,1993,"Adventure, Sci-Fi",A pragmatic paleontologist visiting an almost complete theme park is tasked with protecting a couple of kids after a power failure causes the park's cloned dinosaurs to run loose.
The Social Network,2010,"Biography, Drama","As Harvard student Mark Zuckerberg creates the social networking site that would become known as Facebook, he is sued by the twins who claimed he stole their idea, and by the co-founder who was later squeezed out of the business."
Inception,2010,"Action, Adventure, Sci-Fi",A thief who steals corporate secrets through the use of dream-sharing technology is given the inverse task of planting an idea into the mind of a C.E.O.
The Shawshank Redemption,1994,Drama,"Two imprisoned men bond over a number of years, finding solace and eventual redemption through acts of common decency."
The Godfather,1972,"Crime, Drama",The aging patriarch of an organized crime dynasty transfers control of his clandestine empire to his reluctant son.
Pulp Fiction,1994,"Crime, Drama","The lives of two mob hitmen, a boxer, a gangster and his wife, and a pair of diner bandits intertwine in four tales of violence and redemption."
The Dark Knight,2008,"Action, Crime, Drama","When the menace known as the Joker wreaks havoc and chaos on the people of Gotham, Batman must accept one of the greatest psychological and physical tests of his ability to fight injustice."
Schindler's List,1993,"Biography, Drama, History","In German-occupied Poland during World War II, industrialist Oskar Schindler gradually becomes concerned for his Jewish workforce after witnessing their persecution by the Nazis."
The Lord of the Rings: The Return of the King,2003,"Adventure, Fantasy, Drama",Gandalf and Aragorn lead the World of Men against Sauron's army to draw his gaze from Frodo and Sam as they approach Mount Doom with the One Ring.
Fight Club,1999,Drama,"An insomniac office worker and a devil-may-care soapmaker form an underground fight club that evolves into something much, much more."
The Matrix,1999,"Action, Sci-Fi",A computer hacker learns from mysterious rebels about the true nature of his reality and his role in the war against its controllers.
Forrest Gump,1994,"Drama, Romance","The presidencies of Kennedy and Johnson, the events of Vietnam, Watergate, and other history unfold through the perspective of an Alabama man with an IQ of 75."
Goodfellas,1990,"Crime, Drama, Biography","The story of Henry Hill and his life in the mob, covering his relationship with his wife Karen Hill and his mob partners Jimmy Conway and Tommy DeVito in the Italian-American crime syndicate."
The Silence of the Lambs,1991,"Crime, Drama, Thriller","A young F.B.I. cadet must receive the help of an incarcerated and manipulative cannibal killer to help catch another serial killer, a madman who skins his victims."
Interstellar,2014,"Adventure, Drama, Sci-Fi",A team of explorers travel through a wormhole in space in an attempt to ensure humanity's survival.
The Prestige,2006,"Drama, Mystery, Sci-Fi","After a tragic accident, two stage magicians engage in a battle to create the ultimate illusion while sacrificing everything they have to outwit each other."
The Departed,2006,"Crime, Drama, Thriller",An undercover cop and a mole in the police attempt to identify each other while infiltrating an Irish gang in South Boston.
Titanic,1997,"Drama, Romance","A seventeen-year-old aristocrat falls in love with a kind but poor artist aboard the luxurious, ill-fated R.M.S. Titanic."
Parasite,2019,"Drama, Thriller, Comedy",Greed and class discrimination threaten the newly formed symbiotic relationship between the wealthy Park family and the destitute Kim clan.
The Lion King,1994,"Animation, Adventure, Drama","Lion prince Simba and his father are targeted by his bitter uncle, who wants to ascend the throne himself."
Spirited Away,2001,"Animation, Adventure, Fantasy","During her family's move to the suburbs, a sullen 10-year-old girl wanders into a world ruled by gods, witches, and spirits, and where humans are changed into beasts."
The Shape of Water,2017,"Drama, Fantasy, Romance","At a top secret research facility in the 1960s, a lonely janitor forms a unique relationship with an amphibious creature that is being held in captivity."
Get Out,2017,"Horror, Mystery, Thriller","A young African-American visits his white girlfriend's parents for the weekend, where his simmering uneasiness about their reception of him eventually reaches a boiling point."
CODA,2021,"Drama, Music","As a CODA (Child of Deaf Adults), Ruby is the only hearing person in her deaf family. When the family's fishing business is threatened, Ruby finds herself torn between pursuing her love of music and her fear of abandoning her parents."
Dune,2021,"Action, Adventure, Sci-Fi",A noble family becomes embroiled in a war for control over the galaxy's most valuable asset while its heir becomes troubled by visions of a dark future.
The Power of the Dog,2021,"Drama, Romance, Western","Charismatic rancher Phil Burbank inspires fear and awe in those around him. When his brother brings home a new wife and her son, Phil torments them until he finds himself exposed to the possibility of love."
The French Dispatch,2021,"Comedy, Drama, Romance",A love letter to journalists set in an outpost of an American newspaper in a fictional twentieth century French city that brings to life a collection of stories published in 'The French Dispatch'.
Summer of Soul,2021,"Documentary, Music","During the same summer as Woodstock, over 300,000 people attended the Harlem Cultural Festival, celebrating African American music and culture, and promoting Black pride and unity. The footage from the festival sat in a basement for 50 years."
Belfast,2021,"Biography, Drama",A young boy and his working-class Belfast family experience the tumultuous late 1960s.
No Time to Die,2021,"Action, Adventure, Thriller","James Bond has left active service. His peace is short-lived when Felix Leiter, an old friend from the CIA, turns up asking for help, leading Bond onto the trail of a mysterious villain armed with dangerous new technology."
Spider-Man: No Way Home,2021,"Action, Adventure, Fantasy","With Spider-Man's identity now revealed, Peter asks Doctor Strange for help. When a spell goes wrong, dangerous foes from other worlds start to appear, forcing Peter to discover what it truly means to be Spider-Man."
"Tick, Tick... Boom!",2021,"Biography, Drama, Musical","On the cusp of his 30th birthday, a promising young theater composer navigates love, friendship and the pressures of life as an artist in New York City."
King Richard,2021,"Biography, Drama, Sport",A look at how tennis superstars Venus and Serena Williams became who they are after the coaching from their father Richard Williams.
The Lost Daughter,2021,Drama,A woman's beach vacation takes a dark turn when she begins to confront the troubles of her past.
Encanto,2021,"Animation, Comedy, Family",A Colombian teenage girl has to face the frustration of being the only member of her family without magical powers.
The Green Knight,2021,"Adventure, Drama, Fantasy",A fantasy retelling of the medieval story of Sir Gawain and the Green Knight.
Drive My Car,2021,Drama,A renowned stage actor and director learns to cope with his wife's unexpected passing when he receives an offer to direct a production of Uncle Vanya in Hiroshima.
The Worst Person in the World,2021,"Comedy, Drama, Romance","The chronicles of four years in the life of Julie, a young woman who navigates the troubled waters of her love life and struggles to find her career path, leading her to take a realistic look at who she really is."
Licorice Pizza,2021,"Comedy, Drama, Romance","The story of Alana Kane and Gary Valentine growing up, running around and going through the treacherous navigation of first love in the San Fernando Valley, 1973."
Everything Everywhere All at Once,2022,"Action, Adventure, Comedy","An aging Chinese immigrant is swept up in an insane adventure, where she alone can save the world by exploring other universes connecting with the lives she could have led."
Top Gun: Maverick,2022,"Action, Drama","After more than thirty years of service as one of the Navy's top aviators, Pete Mitchell is where he belongs, pushing the envelope as a courageous test pilot and dodging the advancement in rank that would ground him."
The Batman,2022,"Action, Crime, Drama","When the Riddler, a sadistic serial killer, begins murdering key political figures in Gotham, Batman is forced to investigate the city's hidden corruption and question his family's involvement."
Nope,2022,"Horror, Mystery, Sci-Fi",The residents of a lonely gulch in inland California bear witness to an uncanny and chilling discovery.
The Banshees of Inisherin,2022,"Comedy, Drama","Two lifelong friends find themselves at an impasse when one abruptly ends their relationship, with alarming consequences for both of them."
All Quiet on the Western Front,2022,"Action, Drama, War",A young German soldier's terrifying experiences and distress on the western front during World War I.
The Fabelmans,2022,Drama,"Growing up in post-World War II era Arizona, a young man named Sammy Fabelman discovers a shattering family secret and explores how the power of films can help him see the truth."
Decision to Leave,2022,"Crime, Drama, Mystery",A detective investigating a man's death in the mountains meets the dead man's mysterious wife in the course of his dogged sleuthing.
RRR,2022,"Action, Drama",A fictional history of two legendary revolutionaries' journey away from home before they began fighting for their country in the 1920s.
Aftersun,2022,Drama,Sophie reflects on the shared joy and private melancholy of a holiday she took with her father twenty years earlier. Memories real and imagined fill the gaps between as she tries to reconcile the father she knew with the man she didn't.
The Whale,2022,Drama,A reclusive English teacher suffering from severe obesity attempts to reconnect with his estranged teenage daughter for one last chance at redemption.
Avatar: The Way of Water,2022,"Action, Adventure, Fantasy","Jake Sully lives with his newfound family formed on the extrasolar moon Pandora. Once a familiar threat returns to finish what was previously started, Jake must work with Neytiri and the army of the Na'vi race to protect their home."
Tár,2022,"Drama, Music","Set in the international world of Western classical music, the film centers on Lydia Tár, widely considered one of the greatest living composer-conductors and the very first female director of a major German orchestra."
Triangle of Sadness,2022,"Comedy, Drama",A fashion model celebrity couple join an eventful cruise for the super-rich.
Babylon,2022,"Comedy, Drama, History","A tale of outsized ambition and outrageous excess, it traces the rise and fall of multiple characters during an era of unbridled decadence and depravity in early Hollywood."
Glass Onion: A Knives Out Mystery,2022,"Comedy, Crime, Drama",Famed Southern detective Benoit Blanc travels to Greece for his latest case.
Women Talking,2022,Drama,"Do nothing. Stay and fight. Or leave. In 2010, the women of an isolated religious community grapple with reconciling a brutal reality with their faith."
The Menu,2022,"Comedy, Horror, Thriller","A young couple travels to a remote island to eat at an exclusive restaurant where the chef has prepared a lavish menu, with some shocking surprises."
Pearl,2022,Horror,"In 1918, a young woman on the brink of madness pursues stardom in a desperate attempt to escape the drudgery, isolation and lovelessness of life on her parents' farm."
Moonage Daydream,2022,"Documentary, Music","A cinematic odyssey exploring David Bowie's creative and musical journey. From visionary filmmaker Brett Morgen, and sanctioned by the Bowie estate."
Barbie,2023,"Adventure, Comedy, Fantasy","Barbie and Ken are having the time of their lives in the colorful and seemingly perfect world of Barbie Land. However, when they get a chance to go to the real world, they soon discover the joys and perils of living among humans."
Oppenheimer,2023,"Biography, Drama, History",The story of American scientist J. Robert Oppenheimer and his role in the development of the atomic bomb during World War II.
Killers of the Flower Moon,2023,"Crime, Drama, History","When oil is discovered in 1920s Oklahoma under Osage Nation land, the Osage people are murdered one by one - until the FBI steps in to unravel the mystery."
Past Lives,2023,"Drama, Romance","Nora and Hae Sung, two deeply connected childhood friends, are wrest apart after Nora's family emigrates from South Korea. Two decades later, they are reunited in New York for one fateful week as they confront notions of destiny and love."
The Holdovers,2023,"Comedy, Drama",A cranky history teacher at a remote prep school is forced to remain on campus over the holidays with a troubled student who has no place to go.
Poor Things,2023,"Comedy, Drama, Romance","The incredible tale about the fantastical evolution of Bella Baxter, a young woman brought back to life by the brilliant and unorthodox scientist Dr. Godwin Baxter."
Anatomy of a Fall,2023,"Crime, Drama, Mystery","A woman is suspected of her husband's murder, and their blind son faces a moral dilemma as the sole witness."
Spider-Man: Across the Spider-Verse,2023,"Animation, Action, Adventure","Miles Morales catapults across the Multiverse, where he encounters a team of Spider-People charged with protecting its very existence. When the heroes clash on how to handle a new threat, Miles must redefine what it means to be a hero."
Saltburn,2023,"Comedy, Drama, Thriller","A student at Oxford University finds himself drawn into the world of a charming and aristocratic classmate, who invites him to his eccentric family's sprawling estate for a summer never to be forgotten."
The Zone of Interest,2023,"Drama, History, Thriller","The commandant of Auschwitz, Rudolf Höss, and his wife Hedwig, strive to build a dream life for their family in a house and garden next to the camp."
The Boy and the Heron,2023,"Animation, Adventure, Drama","A young boy named Mahito, yearning for his mother, ventures into a world shared by the living and the dead. There, death comes to an end, and life finds a new beginning."
May December,2023,"Comedy, Drama","Twenty years after their notorious tabloid romance gripped the nation, a married couple buckles under the pressure when an actress arrives to do research for a film about their past."
Godzilla Minus One,2023,"Action, Adventure, Drama","Post war Japan is at its lowest point when a new crisis emerges in the form of a giant monster, baptized in the horrific power of the atomic bomb."
Maestro,2023,"Biography, Drama, Music","This film tells the complex love story of Leonard Bernstein and Felicia Montealegre Cohn Bernstein, a story that spans over 30 years-from the time they met in 1946 at a party and continuing through two engagements, a 25-year marriage, and three children."
Napoleon,2023,"Action, Biography, Drama","An epic that details the checkered rise and fall of French Emperor Napoleon Bonaparte and his relentless journey to power through the prism of his addictive, volatile relationship with his wife, Josephine."
The Color Purple,2023,"Drama, Musical","A woman named Celie survives incredible abuse and bigotry. Forced into an abusive marriage with a much older man whom she calls 'Mister,' Celie discovers her self-worth through the help of two remarkable women."
Guardians of the Galaxy Vol. 3,2023,"Action, Adventure, Comedy","Still reeling from the loss of Gamora, Peter Quill rallies his team to defend the universe and one of their own - a mission that could mean the end of the Guardians if not successful."
John Wick: Chapter 4,2023,"Action, Crime, Thriller","John Wick uncovers a path to defeating The High Table. But before he can earn his freedom, Wick must face off against a new enemy with powerful alliances across the globe and forces that turn old friends into foes."
Mission: Impossible - Dead Reckoning Part One,2023,"Action, Adventure, Thriller",Ethan Hunt and his IMF team must track down a dangerous weapon before it falls into the wrong hands.
Asteroid City,2023,"Comedy, Drama, Romance",Following a writer on his world famous fictional digest as multiple stories begin to intertwine and overlap with one another.
Beau Is Afraid,2023,"Comedy, Drama, Horror",Following a paranoid man who embarks on an epic odyssey to get home to his mother.
Talk to Me,2023,"Horror, Thriller","When a group of friends discover how to conjure spirits using an embalmed hand, they become hooked on the new thrill, until one of them goes too far and unleashes terrifying supernatural forces."
The Killer,2023,"Action, Crime, Thriller",A ruthless assassin on the verge of retirement is on the hunt for anyone who forced him to miss a target.
Blue Beetle,2023,"Action, Adventure, Sci-Fi","An alien scarab chooses Jaime Reyes to be its symbiotic host, giving the Mexican American college graduate an incredible superpowered armor and weaponry."
Creed III,2023,"Drama, Sport","Adonis Creed is thriving in both his career and family life, but when Damian, a childhood friend and former boxing prodigy resurfaces after serving time in prison, he's eager to prove that he deserves his shot in the ring."
Dumb Money,2023,"Biography, Comedy, Drama","The story of two everyday people who fought back against hedge funds and billionaires on Wall Street, and in the process, they both make millions and inspire a worldwide movement against Wall Street."
Bottoms,2023,"Comedy, Sport",Two unpopular queer high school students start a fight club to have sex before graduation.
Scream VI,2023,"Horror, Mystery, Thriller","Four survivors of the Ghostface murders leave Woodsboro behind for a fresh start in New York City. However, they're not safe as the killer reemerges to cause more mayhem."
Memento,2000,"Mystery, Thriller",A man with short-term memory loss attempts to track down his wife's murderer.
City of God,2002,"Crime, Drama","In the slums of Rio, two kids' paths diverge as one struggles to become a photographer and the other a kingpin."
The Grand Budapest Hotel,2014,"Adventure, Comedy, Crime","A writer encounters the owner of an aging high-class hotel, who tells him of his early years serving as a lobby boy in the hotel's glorious years under an exceptional concierge."
Whiplash,2014,"Drama, Music",A promising young drummer enrolls at a cut-throat music conservatory where his dreams of greatness are mentored by an instructor who will stop at nothing to realize a student's potential.
Coco,2017,"Animation, Adventure, Family","Aspiring musician Miguel, confronted with his family's ancestral ban on music, enters the Land of the Dead to find his great-great-grandfather, a legendary singer."
The Witch,2015,"Horror, Mystery","A family in 1630s New England is torn apart by the forces of witchcraft, black magic, and possession."
Moonlight,2016,Drama,"A young African-American man grapples with his identity and sexuality while experiencing the everyday struggles of childhood, adolescence, and burgeoning adulthood."
The Farewell,2019,"Comedy, Drama","A Chinese family discovers their grandmother has only a short while left to live and decide to keep her in the dark, scheduling a wedding to gather before she dies."
Nomadland,2020,Drama,"After losing everything in the Great Recession, a woman embarks on a journey through the American West, living as a van-dwelling modern-day nomad."
Soul,2020,"Animation, Adventure, Comedy","After landing the gig of a lifetime, a New York jazz pianist suddenly finds himself trapped in a strange land between Earth and the afterlife."
The Father,2020,Drama,"A man refuses all assistance from his daughter as he ages. As he tries to make sense of his changing circumstances, he begins to doubt his loved ones, his own mind and even the fabric of his reality."
Sound of Metal,2019,"Drama, Music",A heavy-metal drummer's life is thrown into freefall when he begins to lose his hearing.
Minari,2020,Drama,A Korean family starts a farm in 1980s Arkansas.
Promising Young Woman,2020,"Crime, Drama, Thriller","A young woman, traumatized by a tragic event in her past, seeks out vengeance against those who crossed her path."
Palm Springs,2020,"Comedy, Fantasy, Romance","Stuck in a time loop, two wedding guests develop a budding romance while living the same day over and over again."
The Lighthouse,2019,"Drama, Fantasy, Horror",Two lighthouse keepers try to maintain their sanity while living on a remote and mysterious New England island in the 1890s.
Uncut Gems,2019,"Crime, Drama, Thriller","With his debts mounting and angry collectors closing in, a fast-talking New York City jeweler risks everything in hope of staying afloat and alive."
Little Women,2019,"Drama, Romance","Jo March reflects back and forth on her life, telling the beloved story of the March sisters - four young women, each determined to live life on her own terms."
Marriage Story,2019,"Comedy, Drama, Romance",Noah Baumbach's incisive and compassionate look at a marriage breaking up and a family staying together.
Portrait of a Lady on Fire,2019,"Drama, Romance","On an isolated island in Brittany at the end of the eighteenth century, a female painter is obliged to paint a wedding portrait of a young woman."
